{
    "$schema": "http://json-schema.org/draft-04/schema",
    "title": "This schema describes the engine arguments schema",
    "description": "The engine arguments schema",
    "type": "object",
    "$ref": "http://json-schema.org/draft-04/schema",
    "properties": {
        "$schema": {
        },
        "type": {
        },
        "allOf": {
        },
        "id": {
            "type": "string",
            "description": "The engine id"  
        },
        "definitions": {
            "description": "The arguments definitions",
            "type": "object",
            "$ref": "http://json-schema.org/draft-04/schema",
            "properties": {
                "cmd": {
                    "type": "object",
                    "description": "The specific configuraton for cmd",
                    "properties": {
                        "executable": {
                            "type": "string",
                            "description": "The engine executable, by default equal to the engine name"
                        },
                        "masks": {
                            "type": "boolean",
                            "description": "Can use masks for multiple files analyze",
                            "default": true
                        },
                        "success": {
                            "type": "integer",
                            "description": "The success exit code",
                            "default": 0
                        },
                        "version": {
                            "type": "string",
                            "description": "The engine version, equal to the output of version command"
                        }   
                    }
                },
                "options": {
                    "type": "object",
                    "description": "The engine options",
                    "$ref": "http://json-schema.org/draft-04/schema"
                },
                "section": {
                    "type": "object",
                    "description": "The engine configuration section",
                    "$ref": "http://json-schema.org/draft-04/schema"
                }
            },
            "required": [
                "section"
            ],
            "additionalProperties": false
        }
    },
    "required": [
        "id",
        "definitions"
    ],
    "additionalProperties": false
}
